{
  "schema_version": 2,
  "diagram_type": "workflow",
  "meta": { "title": "Request workflow", "output": "minimal.workflow.html", "input_contract": "phoenix-v1", "quality_profile": "showcase", "locale": "en" },
  "lanes": [{ "id": "work", "label": "Work" }],
  "nodes": [
    { "id": "prepare", "lane": "work", "col": 0, "type": "backend", "label": "Prepare" },
    { "id": "complete", "lane": "work", "col": 1, "type": "backend", "label": "Complete" }
  ],
  "edges": [{ "id": "continue", "from": "prepare", "to": "complete", "label": "Continue", "role": "main" }],
  "mainPath": ["prepare", "complete"]
}
